index,title,simpletags,deepertags
134,Sports Medicine,bachelor medicine bachelor surgery doctor medicine sports master physical therapy physiotherapy clinical biomechanics rehabilitation master masters master's bachelors bachelor's conditioning post graduate diploma orthopedic orthopedics exercise national board health family welfare clinical management strength science dnb dsm diplomate national board ,"Assessment Evaluation Sports Medicine Biomechanics Applied Basic Medicine Sciences Research Educational Methodology Kinesiology Applied Para Clinical Sciences Physical Medicine Exercise Physiology Nutrition Kinanthropometry Non-Traumatic Medical Conditions Athlete Sports Traumatology Sports Physical Medicine Applied Exercise Physiology Current Concepts Sports Medicine Sports Psychology	Emergency Care Cardiopulmonary Therapeutics Medical Aspects Sports Medicine Foundations Principles Healthcare Management"
138,Investment Banking,Chartered Financial Analysts CFA Certified Financial Planner CFP Financial Risk Manager FRM Chartered Alternative Investment Analyst CAIA Certified Public Accountant CPA Chartered Mutual Fund Counsellor CMFC Investment Banking Certification NYIF Certified Financial Modeling Valuation Analyst FMVA Mergers Acquisitions Professional Certificate NYIF Professional Certificate Valuation NYIF Capital Markets Professional Certificate NYIF Certified Management Accountant,Design enable execute measure product program launches market plans Develop marketing plans collaborating demand gen web/digital customer marketing compelling messaging customer marketing assets sales enablement assets marketing sales partner team Continually improve enablement Python Matlab R q KDB  SQL Java C++ business model strategy products new markets Preparing analyzing explaining historical projected financial information preparation financial models business valuations  Advisory services mergers acquisitions strategic assignments Industry coverage Consumer Retail Real Estate Gaming Lodging Leisure Financial Institutions Healthcare Technology Media Telecoms Industrials Financial Sponsors Client Financing Solutions Product specialists capital markets financing functions including Acquisition Leveraged Finance Equity Capital Markets Debt Capital Markets Syndicate industry company-specific business due diligence quantitative analysis managing manipulating simplifying analyzing complex datasets SQL Python R Proven develop actionable recommendations qualitative quantitative data quantitative modeling abilities data heavy insights technical non-technical debt equity financing M&A modeling valuation techniques analytical quantitative problem solving Drafting Developing underlying trends business models Product Engineering Marketing Finance teams Conducting fundamental due diligence financial analyses investment opportunities Creating financial models valuation frameworks price analyses investment theses management teams sell side research analysts Equity Capital Markets Sales Trading professionals market industry participants investment banking investment management financial modelling analysis skills 
139,Chartered Financial Analysts (CFA),Chartered Financial Analysts CFA,"accounting finance Excel skills financial modeling business valuation intermediate finance financial analysis accounting principles methods models Excel statement model DCF model M&A model Valuing business comparable company analysis precedent transactions discounted cash flow Distilling large amounts insightful charts graphs presentations Communicating results financial analysis executive decision making Ethical and Professional Standards	Quantitative Methods Economics Financial Statement Analysis Corporate Issuers Equity Investments Fixed Income Derivatives Alternative Investments Portfolio Management Wealth Planning"
140,Certified Financial Planner (CFP),Certified Financial Planner CFP,risk management retirement planning debt management investment planning Professional Conduct Regulation Financial Planning Risk Management Insurance Planning Investment Planning Tax Planning Retirement Savings Income Planning Estate Planning Psychology Financial Planning Financial Plan Development
141,Financial Risk Manager (FRM),Financial Risk Manager FRM,Risk Management Quantitative Analysis Financial Markets Products Valuation Risk Models Market Risk Measurement Management Credit Risk Measurement Management Operational Integrated Risk Management Risk Management Investment Management Current Issues Financial Markets 
142,Chartered Alternative Investment Analyst (CAIA),Chartered Alternative Investment Analyst CAIA,hedge funds venture capital private equity derivatives real estate Professional Standards Ethics Alternative Investments Real Assets Commodities Hedge Funds Private Equity Structured Products Models Institutional Asset Owners Investment Policies Risk Management Methods Alternative Investing Due Diligence Selecting Strategies Volatility Complex Strategies Current Integrated Topics Securities Commodity Contracts Financial Investments Credit Intermediation Professional Scientific Technical Services Management Companies Enterprises Insurance Carries Investment Analyst Investment Manager Portfolio Manager Credit Structurer Risk Analyst
143,Certified Public Accountant (CPA),Certified Public Accountant CPA,"Fundamentals Internal Auditing Internal Audit SchoolAuditing Cybersecurity Program Auditing Fraud Payroll Audit Report Writing  Auditing Courses Auditing Fraud Forensic Accounting Payroll Administration Retirement Plan Administration Sales Tax Tax Prep
Insurance Securities Licensing"
144,Chartered Mutual Fund Counsellor (CMFC),Chartered Mutual Fund Counsellor CMFC,Chartered Mutual Fund Counselor open closed-end funds packaged investment products risk return asset allocation mutual fund retirement planning Investment Management Investment Management Python Machine Learning Portfolio Risk Management International Taxation Portfolio Management Strategies Wealth Management Planning Advanced Wealth Management  Mutual Funds Various Mutual Fund Products Selecting Right Mutual Fund Operation Mutual Fund Company Trends Mutual Fund Industry Exchange Traded Funds 
145,Investment Banking Certification from NYIF,Investment Banking Certification NYIF, Financial Management Financial Statements Recording Financial Information Budgeting Managers Analyzing Benchmarking Financial Information Financial Statements Risk Analysis Ratios Accounting Principles Valuation Basics Time Value Money Basic Valuation Statistics Regression Analysis Free Cash Flow Components Free Cash Flow Capital Budgeting Free Cash Flow Cash Flow Evaluate Investment Opportunities Financial Industry Overview Career Skills Tools Securities Industry Equity Securities Debt Securities Trading Securities Secondary Markets Processing Securities Transactions Common Stock Preferred Stocks Equity-Linked Indexes Bonds Fixed Income Markets Bond Risks Derivatives Futures Forwards Swaps Options Corporate Finance Time Value Money Time Value Applications Capital Budgeting Factors Affecting Financial Decisions Business Valuation The Foundations of Free Cash Flows Weighted Average Cost of Capital Terminal Value DCF Approach Business Valuation limitations DCF Approach Corporate Credit Analysis Industry Company Forecasting Financial Analysis Qualitative Non-financial Analysis Credit Rating Credit Scoring Measuring Risk Portfolio Risk Measurement Operational Risk Fixed Income Portfolio Management Equity Portfolio Management PORTFOLIO MANAGEMENT HEDGE FUNDS PRIVATE EQUITY BUSINESS VALUATION
146,Certified Financial Modeling & Valuation Analyst (FMVA),Certified Financial Modeling Valuation Analyst FMVA,Accounting fundamentals Reading financial statements Fixed income fundamentals Excel crash course for corporate finance Introduction to corporate finance Math for corporate finance Excel modeling fundamentals Accounting fundamentals Financial models and templates library Financial analysis fundamentals Accounting fundamentals Reading financial statements Excel crash course Building a financial model Accounting fundamentals Financial analysis fundamentals Business valuation modeling Budgeting forecasting Accounting fundamentals FP&A monthly cash flow forecasting Building financial model Scenario sensitivity analysis Business valuation modeling Advanced excel formulas Behavioral finance fundamentals Real estate financial modeling Building financial model Excel Business valuation modeling Startup e-commerce financial model Mining financial model valuation Mergers acquisitions M&A modeling Building financial model Business valuation modeling Leverage buyout LBO modeling Financial modeling VBA Business valuation modeling Corporate business strategy 
147,Mergers & Acquisitions Professional Certificate from NYIF,Mergers Acquisitions Professional Certificate NYIF, Mergers Acquisitions Overview Key Drivers Successful Acquisition Attractiveness Target Companies Acquisition Structure Sequence Events Documentation Agreements Managing Value Creation Value Creation Valuation Financing Acquisition Anti-takeover Mechanisms  Anti-trust Policies Free Cash Flow Components Free Cash Flow Cost Capital Capital Budgeting Using Free Cash Flow Modified Free Cash Flow Using Free Cash Flow Evaluate Acquisition Opportunities Integration Acquisitions Legal structures Tax structures Accounting  Letter Intent Seller paper earn outs hope certificates Special cases Tax loss mergers Break-up sum-of-the-parts split-offs LBOs Roll-ups consolidation plays Distressed Bankruptcy M&A Special Purpose Acquisition Corp SPAC Blind pool Reverse merger backdoor IPO Equity Method Consolidation Purchase Accounting Business Combinations Forecasting Performance Combined Company Internal Revenue Code Section Transactions
148,Professional Certificate in Valuation from NYIF,Professional Certificate Valuation NYIF, Time value money Present future value Compounding annual periodic continuous Annuities perpetuities Complex problems Project Analysis Payback discounted payback Internal rate return IRR modified IRR Net present value NPV EVA Pros cons Discounted Cash Flow Valuation Financial Statements DCF intrinsic valuation Cash Flows Real nominal returns Terminal Value Asset values Comparables Perpetuities growing perpetuities Enterprise Value Equity Value Risk return overview Cost Debt Straight Convertible Cost Equity Capital Asset Pricing Model Alpha Beta Equity risk premium Other methods Weighted Average Cost Capital -n theory MM practice Costs financial distress Optimal capital structure Adjusted Present Value Differences WACC valuation process Pros cons Peer Group Valuation  Selecting peer group Key ratios P Es EV EBITDA etc  Bank lending Term loans lines credit Bilateral syndicated loans Debt Investment grade High yield Convertibles Preferreds Equity Private Equity Venture Capital Private Equity Public Equity IPOs Secondary US Rights Offerings Europe Mergers Acquisitions Rationale Payment Leveraged Buyouts Management Buyouts Wrap-up case study  
149,Capital Markets Professional Certificate from NYIF,Capital Markets Professional Certificate NYIF,Capital Markets Key Participants Money Markets Interbank Loans Deposits Certificates Deposit Commercial Paper Repos Treasury Bills Bankers Acceptances Foreign Exchange FX Time Value Money Structure FX Market Market Trades FX Prices Spot Rates Prices Calculating Simple Values Cross Rates FX Forwards Global Financial Markets  global trends financial products articulate macroeconomic reasons bonds equity foreign exchange money market products traded Structure price bond market place financial system capital markets regulation bond equity derivative hedge against risk in real-life financial situations profit loss futures trades swap and calculate the benefit of the swap counterparty Invest money pension fund both geographically asset class equity both issuer's investor's perspectives Distinguish different types stock markets equity valuation major steps IPO process financial Futures Forwards Banking Financial Markets Work Together Derivatives Credit Derivatives Financial Intermediaries Indirect Finance Swaps Options Equity Bond IPO Participants  Types Financial Intermediaries Regulation Financial System Equity Indexes Market Equity Valuation Timing Major Steps IPO Process Debt Equity Money Markets Foreign Exchange Equity Investment Vehicles Internationalization Financial Markets Bond Markets Risk Equity Markets Trading
150,Certified Management Accountant,Certified Management Accountant,"External Financial Reporting Decisions Planning Budgeting Forecasting Performance Management Cost Management Internal Controls Technology Analytics 	Financial Statement Analysis Corporate Finance Decision Analysis Risk Management Investment Decisions Professional Ethics"
153,CCNA Voice,CCNA Voice ,Telephony Call Routing VOIP Call Routing CUCME Call Routing Basics Preparing Network Voice IP Phone Behavior CUCME Administration Basics CUCME StandUp CUCME CUCME StandUp CUCME End Users End User Interfaces Endpoint Implementation Call Coverage Calling Restrictions Routing CUCME Advance Call Coverage Implementing Unity Connection
154,CCNP Voice,CCNP Voice ,"Operating Cisco Collaboration Core Technologies CLCOR Concentration exams CLICA Cisco Collaboration Applications CLICA CLACCM	Cisco Advanced Call Control Mobility Services CLACCM CLCEI Cisco Collaboration Cloud Edge CLCEI CLCNF Cisco Collaboration Conferencing CLCNF CLAUTO Implementing Automation Cisco Collaboration Solutions CLAUI"
155,CCIE Voice,CCIE Voice,infrastructure design protocols codecs endpoints Cisco IOS XE gateway media resources Call Control QoS collaboration applications
157,Institute for Operations Research and the Management Sciences (INFORMS) Certified Analytics Professional (CAP),Institute for Operations Research and the Management Sciences INFORMS Certified Analytics Professional CAP,
158,SAS Certified Big Data Professional,SAS Certified Big Data Professional,Recognize overcome big data challenges Implement critical SAS programming techniques Access transform manipulate data quality reporting analytics statistical techniques Work SAS Hadoop Hive Statistics Visual Exploration Big Data Programming Loading
159,Data Science Council of America (DASCA) Senior Data Scientist (SDS),Data Science Council America DASCA Senior Data Scientist SDS,Statistics central tendencies dispersions averages permutations combinations probability creating graphs charts histograms scatter plots Data Science Applications Business Framework Data Science Driving Business Big Data Analytics Building Pan-Organization Support Data Science Essentials Data Scientists Analytics Essentials Data Scientists Data Scientists strategy data analytics information intelligence visualization score development monetization metamorphosis big data analytics data science Data Lake analytics decision-making strategy business model maturity index preparing big data strategy documentuser experience catalyzing business performance outcomes through business intelligence Unsupervised learning clustering dimensionality reduction regression fundamentals Data Encoding File Formats High-volume streaming data storage real-time streaming data architectures stream batch data processing software engineering Natural Language Processing Time Series Analysis fundamentals Statistics Linear Algebra Probability
160,Big Data Engineering Certifications,Big Data Engineering Certifications,Computer Science Information Technology Computer Applications Programming  Developers Engineers Problem solving Programming Python C++ Java R Platform usage Hadoop Spark etc  SQL NoSQL databases Data mining RDBMS Data structure algorithms Data security management Machine learning AI Tools streaming data capture storage transmission processing Quantitative analysis R Interpretation data visualization
161,Big Data Analytics Certifications,Big Data Analytics Certifications,Problem solving Platform usage Hadoop Spark SQL NoSQL databases Data mining RDBMS Quantitative analysis using R Data structure algorithms streaming data capture storage transmission processing Interpretation data visualization Data security management Programming Python C++ Java Programming R Machine learning AI Business Statistics Marketing Research
162,Data Scientist Certifications,Data Scientist Certifications,Research Design Data Engineering Machine Learning Mining Exploring Data Visualization Ethics Privacy Statistical Analysis Communicating Results Data Science Programming Research Design Application Data Analysis Statistics Data Science Data Engineering Applied Machine Learning Experiments Causal Inference Behind Data Humans Values Deep Cloud Statistical Methods for Discrete Response Time Series Panel Data Machine Learning Scale Natural Language Processing Deep Learning Machine Learning Systems Engineering Computer Vision
163,Oracle Business Intelligence Certification,Oracle Business Intelligence Certification, report model analyze forecast OBIEE Building BI Server metadata repository dashboards Constructing ad hoc queries security settings Configuring managing cache files Oracle BI EPM System Overview Oracle BI Installation Dimensional Modeling Build-Basic Repository Complex Repository Modeling Building Repository Multiple Sources Variables Business Intelligence Enterprise Edition Security MS Office Integration Write Back within OBI EE 
164,EMC Data Science and Big Data Analytics Certification,EMC Data Science Big Data Analytics Certification,Introduction Course Agenda Introduction Big Data Analytics Big Data Overview State Practice Analytics Data Scientist Big Data Analytics Industry Verticals Data Analytics Lifecycle Discovery Data Preparation Model Planning Model Building Communicating Results Operationalizing Review Basic Data Analytic Methods Using R R Look Data R Analyzing Exploring Data Statistics Model Building Evaluation Advanced Analytics Theory Methods K Means Clustering Association Rules Linear Regression Logistic Regression Naïve Bayesian Classifier Decision Trees Time Series Analysis Text Analysis Advanced Analytics Technologies Tools Unstructured Data MapReduce Hadoop Ecosystem In database Analytics SQL Essentials SQL MADlib In database Analytics Endgame Operationalizing Analytics Project Creating Final Deliverables Data Visualization Techniques Final Lab Exercise Big Data Analytics 
165,MongoDB Certified Developer,MongoDB Certified Developer,database concepts Fundamentals system programming Basic JavaScript programming Fundamentals software development CRUD Create Read Update Delete operations Indexing Performance Single key compound multi key mechanics storage engines performance Aggregation Pipeline operators memory usage sort skip limit Data Modeling Embedding references document growth modeling one-to-one and one-to-many relationships modeling atomic operations modeling tree structures Replication Configuration oplog concepts write concern elections failover deployment multiple data centers Sharding Components shard balancing shard keys hashed shard keys
166,Certified Analytics Professional (CAP),Certified Analytics Professional CAP, Business Problem Framing Analytics Problem Framing Working Data Methodology Selection Model Building Model Deployment Life-Cycle Management Probability Statistics Simulation Predictive Analytics Causal Models Optimization Decision Analysis Anomaly Detection Bayesian Regression Modeling via MCMC Techniques Bayesian Statistics R Cluster Analysis Customer Analytics R Discrete Choice Modeling Conjoint Analysis Financial Risk Modeling Forecasting Analytics Interactive Data Visualization Bayesian Computing Techniques Introduction Bayesian Statistics Design Experiments Network Analysis Logistic Regression Mapping R Matrix Algebra Modeling Count Data Modeling R Natural Language Processing Natural Language Processing Using NLTK Optimization Linear Programming Predictive Analytics Machine Learning Tools Predictive Analytics Machine Learning Tools Python Predictive Analytics R Predictive Analytics Neural Nets Regression Predictive Analytics Neural Nets Regression Dimension Reduction Clustering Association Rules Dimension Reduction Clustering Association Rules R Python Statistical Analysis R Programming Intermediate R Programming R Programming  Regression Analysis Risk Simulation Queuing Spatial Statistics GIS Using R SQL Database Queries Survival Analysis Text Mining Using Python Visualization R ggplot2 
167,Data Science Council of America (DASCA) Principle Data Scientist (PDS),Data Science Council of America DASCA Principle Data Scientist PDS,Data Science Applications in Business Functional Framework Data Science Driving Business Through Big Data Analytics Building Pan-Organization Support Data Science Essentials for Data Scientists Big Data Analytics Essentials for Data Scientists Advanced Data Science Data Scientists
168,Open Certified Data Scientist (Open CDS),Open Certified Data Scientist Open CDS,
169,SAS Certified Advanced Analytics Professional,SAS Certified Advanced Analytics Professional,Prepare data Build predictive models Assess implement models Perform pattern analysis Deploying open source models SAS Text analytics Experiment design business Optimization techniques Time series forecasting Machine learning predictive modeling techniques Application machine learning predictive modeling technique big distributed in-memory data sets
170,SAS Certified Data Scientist,SAS Certified Data Scientist,Manipulate gain insights big data variety SAS open source tools Make business recommendations complex machine learning models Deploy models scale flexible robust SAS environment
171,Google Certified Professional Data Engineer,Google Certified Professional Data Engineer,collecting transforming publishing data design build operationalize secure monitor data processing systems security compliance scalability efficiency reliability fidelity flexibility portability Operationalizing machine learning models
172,Google Data Machine Learning,Google Data Machine Learning, designs builds productionizes ML models Google Cloud technologies knowledge proven ML models techniques training retraining deploying scheduling monitoring ML Engineer designs ML problems Architect ML solutions Design data preparation processing systems Develop ML models Monitoring optimizing maintaining ML Automate orchestrate ML pipelines orchestrating pipelines Monitor optimize solutions data preparation processing
173,Cloudera Certified Associate Data Analyst,Cloudera Certified Associate Data Analyst,Provide Structure Data Language DDL statements create alter structures metastore Hive Impala Create tables data types delimiters file formats Create tables existing tables define schema Improve query performance partitioned tables Alter tables modify existing schema Create views Data Analysis Query Language QL statements Hive Impala analyze data cluster Prepare reports SELECT commands unions subqueries Calculate aggregate statistics sums averages query Create queries against multiple data sources using join commands Transform output format queries using built-in functions Perform queries group windowing functions
174,Cloudera Certified Professional CCP Data Engineer,Cloudera Certified Professional CCP Data Engineer,Create tables data types delimiters file formats Create new tables existing tables define schema Improve query performance creating partitioned tables metastore Alter tables modify existing schema Create views Prepare reports SELECT commands unions subqueries Calculate aggregate statistics sums averages Create queries against multiple data sources join commands Transform output format queries using built-in functions Perform queries group rows using windowing functions 
175,IBM Data Science Professional Certificate,IBM Data Science Professional Certificate,"Data Science methodology Jupyter notebooks create Python apps access relational databases SQL Python use Python libraries generate data visualizations perform data analysis Pandas construct evaluate Machine Learning models Scikit-learn SciPy data science ML Recommender Systems Artificial Intelligence Data Visualization Data Analysis Data Science Machine Learning ML Python SQL Database Jupyter Notebook AI Watson Studio IBM Cloud Db2 Pandas NumPy Bokeh Matplotlib Folium Seaborn Scikit-learn SciPy RStudio Zeppelin Regression Clustering Classification Location Methodology Foursquare Data Science Orientation Tools Data Science Data Science Methodology Python Data Science AI Databases SQL Data Science
Data Visualization Python Data Analysis Python Machine Learning Python Applied Data Science Capstone"
176,Microsoft Certified Solutions Expert (MCSE) Data Management and Analytics,Microsoft Certified Solutions Expert MCSE Data Management Analytics,Microsoft SQL Server Databases Designing Database Solutions Microsoft SQL Server Implementing Data Models Reports Microsoft SQL Server Designing Business Intelligence Solutions Microsoft SQL Server Developing SQL Databases Data Warehouse SQL Developing Data Models Microsoft Azure Cosmos DB Solutions Prerequisite MCSA SQL Server MCSA SQL Database Development SQL Database Administration MCSA SQL BI Development BI Reporting data center identity management systems management virtualization storage networking 
177,Microsoft Certified Azure Data Scientist Associate,Microsoft Certified Azure Data Scientist Associate,planning creating environment data science workloads Azure data experiments train predictive models manage optimize deploy machine learning models production AI visual tools Scikit-Learn PyTorch Tensorflow
